{
  "$schema": "https://json-schema.org/draft/2020-12/schema",
  "title": "Order",
  "description": "A request to generate one image.",
  "type": "object",
  "additionalProperties": false,
  "required": [
    "key",
    "profile",
    "prompt"
  ],
  "dependentRequired": {
    "strength": ["initImage"]
  },
  "properties": {
    "$schema": {
      "type": "string",
      "description": "Schema reference so editors can validate and complete the file."
    },
    "key": {
      "type": "string",
      "pattern": "^[a-z0-9][a-z0-9-]*(/[a-z0-9][a-z0-9-]*)*$",
      "description": "Order key; slash-separated safe segments, no leading slash and no .. segments.",
      "maxLength": 200
    },
    "profile": {
      "$ref": "#/$defs/profileName",
      "description": "Name of the project profile to use."
    },
    "prompt": {
      "type": "string",
      "minLength": 1,
      "description": "Text prompt describing the image.",
      "maxLength": 4000
    },
    "references": {
      "type": "array",
      "items": {
        "$ref": "#/$defs/relativePath"
      },
      "description": "Reference image paths, relative to the project root."
    },
    "initImage": {
      "$ref": "#/$defs/relativePath",
      "description": "Initial image for img2img, relative to the project root."
    },
    "strength": {
      "type": "number",
      "minimum": 0,
      "maximum": 1,
      "description": "How far img2img departs from initImage (0 to 1); needs initImage."
    },
    "seed": {
      "type": "integer",
      "minimum": 0,
      "description": "Random seed."
    },
    "params": {
      "type": "object",
      "additionalProperties": false,
      "description": "Per-order overrides of the profile sampling settings.",
      "properties": {
        "steps": {
          "$ref": "#/$defs/steps"
        },
        "cfg": {
          "$ref": "#/$defs/cfg"
        },
        "sampler": {
          "$ref": "#/$defs/sampler"
        }
      }
    },
    "text": {
      "type": "object",
      "propertyNames": {
        "$ref": "#/$defs/fieldName"
      },
      "additionalProperties": {
        "type": "string",
        "maxLength": 200,
        "pattern": "^[^\\u0000-\\u001f\\u007f\\ud800-\\udfff]*$"
      },
      "description": "Texts for the composition template, by field name (the profile's compose.fields); up to 200 characters, no control characters or lone surrogates."
    },
    "draft": {
      "type": "boolean",
      "default": false,
      "description": "Generate drafts (D32): the profile draft settings, or half size and 8 steps."
    },
    "count": {
      "type": "integer",
      "minimum": 1,
      "maximum": 50,
      "default": 1,
      "description": "Number of consecutive attempts."
    }
  },
  "$defs": {
    "profileName": {
      "type": "string",
      "pattern": "^[a-z][a-z0-9]*$",
      "description": "Profile name: lowercase letters and digits, starting with a letter, no hyphens (the profile is what follows the last hyphen in delivered file names)."
    },
    "relativePath": {
      "type": "string",
      "minLength": 1,
      "pattern": "^(?![/~])(?!.*(^|/)\\.\\.(/|$))[^\\\\\\u0000-\\u001f\\u007f]+$",
      "description": "Relative path that cannot be absolute, start with ~, contain .. segments, backslashes or control characters."
    },
    "steps": {
      "type": "integer",
      "minimum": 1,
      "maximum": 200,
      "description": "Sampling steps."
    },
    "cfg": {
      "type": "number",
      "minimum": 0,
      "maximum": 30,
      "description": "Classifier-free guidance scale."
    },
    "sampler": {
      "type": "string",
      "minLength": 1,
      "description": "Sampler name."
    },
    "fieldName": {
      "type": "string",
      "pattern": "^(?!logo$)[a-z][a-zA-Z0-9]*$",
      "maxLength": 40,
      "description": "Name of a text field of the composition template ({{name}}): starts with a lowercase letter, letters and digits only; \"logo\" is reserved."
    }
  }
}
