{
  "$schema": "../../../gimg/schemas/order.schema.json",
  "key": "fondos/r1",
  "profile": "og",
  "prompt": "Wide abstract technical illustration on a deep dark navy background with a faint fine grid. Several thin glowing lines of light run from left to right splitting apart and merging again, each joint marked by a small round node. In the right half, a small bright capsule of light travels from the end of one line into the start of the next one at a bright meeting node. The lines glow in sky blue, with a few nodes in warm amber and soft green. The left half of the frame is calm and dark, with only the faint grid, nearly empty. Style: clean minimal vector-like digital illustration, thin precise strokes, soft glow, flat dark background. Colours: deep navy, sky blue, amber, soft green, off-white. Mood: calm, precise, trustworthy. The image is completely textless.",
  "seed": 3,
  "count": 2
}
