{
  "$schema": "../../../gimg/schemas/order.schema.json",
  "key": "fondos/r1",
  "profile": "og",
  "prompt": "Wide abstract banner on a deep midnight navy background with a faint grid of tiny evenly spaced dots. In the right half, a single smooth ribbon of light shaped like a sound wave flows in from the centre and curls into a pattern of fine glowing concentric rings made of thin threads of light. The ribbon glows in a warm raspberry pink with soft white highlights along its crests. The left half of the frame is a calm, smooth, dark navy surface, nearly empty and softly out of focus. Style: minimal elegant digital art, thin precise luminous lines, soft glow, smooth gradients. Colours: deep midnight navy, raspberry pink, soft rose and white highlights. Mood: calm, warm, attentive. The image is completely textless.",
  "seed": 3,
  "count": 2
}
